{
  "generated_at_utc": "2026-03-26T11:26:47.969411+00:00",
  "artifact_file": "/Volumes/T7 Touch/mini/rather-not-work-on/platform-planningops/planningops/artifacts/validation/federated-ci-20260326T112231Z-summary-tmp-reconcile-bundle-status-bundle-status.json",
  "status_path": "/Volumes/T7 Touch/mini/rather-not-work-on/platform-planningops/planningops/artifacts/validation/federated-ci-20260326T112231Z-summary-tmp-reconcile-bundle-status-bundle-status.json",
  "status_validation_path": "/Volumes/T7 Touch/mini/rather-not-work-on/platform-planningops/planningops/artifacts/validation/federated-ci-20260326T112231Z-summary-tmp-reconcile-bundle-status-bundle-status-validation.json",
  "bundle_path": "/Volumes/T7 Touch/mini/rather-not-work-on/platform-planningops/planningops/artifacts/validation/federated-ci-20260326T112231Z-summary-tmp-reconcile-bundle-status-bundle.json",
  "bundle_validation_report_path": "/Volumes/T7 Touch/mini/rather-not-work-on/platform-planningops/planningops/artifacts/validation/federated-ci-20260326T112231Z-summary-tmp-reconcile-bundle-status-bundle-validation.json",
  "run_id": "federated-ci-20260326T112231Z",
  "reconcile_status": "healthy",
  "check_name": "loop-guardrails-outer-status-bundle-validation",
  "reconcile_count": 0,
  "reconcile_validation_verdict": "pass",
  "bundle_validation_verdict": "pass",
  "bundle_validation_state": "fresh",
  "ready": true,
  "next_step": "none",
  "status_report": {
    "bundle_path": "/Volumes/T7 Touch/mini/rather-not-work-on/platform-planningops/planningops/artifacts/validation/federated-ci-20260326T112231Z-summary-tmp-reconcile-bundle-status-bundle.json",
    "validation_report_path": "/Volumes/T7 Touch/mini/rather-not-work-on/platform-planningops/planningops/artifacts/validation/federated-ci-20260326T112231Z-summary-tmp-reconcile-bundle-status-bundle-validation.json",
    "bundle_present": true,
    "validation_present": true,
    "artifact_file": "/Volumes/T7 Touch/mini/rather-not-work-on/platform-planningops/planningops/artifacts/validation/federated-ci-20260326T112231Z-summary-tmp-reconcile-bundle-status.json",
    "status_path": "/Volumes/T7 Touch/mini/rather-not-work-on/platform-planningops/planningops/artifacts/validation/federated-ci-20260326T112231Z-summary-tmp-reconcile-bundle-status.json",
    "status_validation_path": "/Volumes/T7 Touch/mini/rather-not-work-on/platform-planningops/planningops/artifacts/validation/federated-ci-20260326T112231Z-summary-tmp-reconcile-bundle-status-validation.json",
    "nested_bundle_path": "/Volumes/T7 Touch/mini/rather-not-work-on/platform-planningops/planningops/artifacts/validation/federated-ci-20260326T112231Z-summary-tmp-reconcile-bundle.json",
    "nested_bundle_validation_report_path": "/Volumes/T7 Touch/mini/rather-not-work-on/platform-planningops/planningops/artifacts/validation/federated-ci-20260326T112231Z-summary-tmp-reconcile-bundle-validation.json",
    "run_id": "federated-ci-20260326T112231Z",
    "reconcile_status": "healthy",
    "check_name": "loop-guardrails-outer-status-bundle-validation",
    "reconcile_count": 0,
    "reconcile_validation_verdict": "pass",
    "bundle_validation_verdict": "pass",
    "bundle_validation_state": "fresh",
    "ready": true,
    "next_step": "none",
    "generated_at_utc": "2026-03-26T11:26:47.656473+00:00",
    "output_path": "/Volumes/T7 Touch/mini/rather-not-work-on/platform-planningops/planningops/artifacts/validation/federated-ci-20260326T112231Z-summary-tmp-reconcile-bundle-status-bundle-status.json",
    "status_validation_output_path": "/Volumes/T7 Touch/mini/rather-not-work-on/platform-planningops/planningops/artifacts/validation/federated-ci-20260326T112231Z-summary-tmp-reconcile-bundle-status-bundle-status-validation.json"
  },
  "status_validation_report": {
    "status_path": "/Volumes/T7 Touch/mini/rather-not-work-on/platform-planningops/planningops/artifacts/validation/federated-ci-20260326T112231Z-summary-tmp-reconcile-bundle-status-bundle-status.json",
    "bundle_path": "/Volumes/T7 Touch/mini/rather-not-work-on/platform-planningops/planningops/artifacts/validation/federated-ci-20260326T112231Z-summary-tmp-reconcile-bundle-status-bundle.json",
    "bundle_validation_report_path": "/Volumes/T7 Touch/mini/rather-not-work-on/platform-planningops/planningops/artifacts/validation/federated-ci-20260326T112231Z-summary-tmp-reconcile-bundle-status-bundle-validation.json",
    "schema_path": "/Volumes/T7 Touch/mini/rather-not-work-on/platform-planningops/planningops/schemas/federated-ci-summary-tmp-reconcile-bundle-status-bundle-status.schema.json",
    "validation_schema_path": "/Volumes/T7 Touch/mini/rather-not-work-on/platform-planningops/planningops/schemas/federated-ci-summary-tmp-reconcile-bundle-status-bundle-status-validation.schema.json",
    "output_path": "/Volumes/T7 Touch/mini/rather-not-work-on/platform-planningops/planningops/artifacts/validation/federated-ci-20260326T112231Z-summary-tmp-reconcile-bundle-status-bundle-status-validation.json",
    "generated_at_utc": "2026-03-26T11:26:47.692719+00:00",
    "verdict": "pass",
    "error_count": 0,
    "warning_count": 0,
    "errors": [],
    "warnings": [],
    "status_generated_at_utc": "2026-03-26T11:26:47.656473+00:00",
    "status_output_path": "/Volumes/T7 Touch/mini/rather-not-work-on/platform-planningops/planningops/artifacts/validation/federated-ci-20260326T112231Z-summary-tmp-reconcile-bundle-status-bundle-status.json",
    "status_validation_output_path": "/Volumes/T7 Touch/mini/rather-not-work-on/platform-planningops/planningops/artifacts/validation/federated-ci-20260326T112231Z-summary-tmp-reconcile-bundle-status-bundle-status-validation.json",
    "status_run_id": "federated-ci-20260326T112231Z",
    "status_reconcile_status": "healthy",
    "status_check_name": "loop-guardrails-outer-status-bundle-validation",
    "status_reconcile_count": 0,
    "status_reconcile_validation_verdict": "pass",
    "status_bundle_validation_verdict": "pass",
    "status_bundle_validation_state": "fresh",
    "status_ready": true,
    "status_next_step": "none"
  }
}
